{
  "atom_id": "src_SYNTH_DAY1_000001",
  "atom_kind": "source_video_atom",
  "atom_stage": "draft",
  "participant_source_id": "SYNTH",
  "source_day": "DAY1",
  "session_id": "SYNTH_DAY1_SESSION1",
  "source_group_id": "group_SYNTH_DAY1_SESSION1",
  "world_event_id": null,
  "source_srt_paths": {
    "transcript": "synthetic/Transcript/SYNTH/DAY1/example.srt",
    "dense_caption": "synthetic/DenseCaption/SYNTH/DAY1/example.srt"
  },
  "source_video_path": null,
  "video_mapping_status": "pending",
  "local_start_sec": 10.0,
  "local_end_sec": 18.0,
  "normalized_start_sec": 10.0,
  "normalized_end_sec": 18.0,
  "transcript_segment_ids": ["tr_SYNTH_001"],
  "dense_caption_segment_ids": ["dc_SYNTH_001"],
  "transcript": "I am starting to cook dinner.",
  "dense_caption": "A person starts preparing food in a kitchen.",
  "visible_text": "A person starts preparing food in a kitchen.",
  "modality_coverage": "both",
  "provenance": "egolife_srt",
  "split": null
}
